{
 "active_phases": null,
 "attempt_index": 1,
 "column_scales": {
  "S1.P": 100000.0,
  "S1.T": 100.0,
  "S1.n.A": 3.0,
  "S1.n.B": 3.0,
  "S1.n.C": 3.0,
  "S2.P": 100000.0,
  "S2.T": 100.0,
  "S2.n.A": 3.0,
  "S2.n.B": 3.0,
  "S2.n.C": 3.0,
  "S3.L": 3.0,
  "S3.P": 100000.0,
  "S3.T": 100.0,
  "S3.V": 3.0,
  "S3.liq.A": 3.0,
  "S3.liq.B": 3.0,
  "S3.liq.C": 3.0,
  "S3.n.A": 3.0,
  "S3.n.B": 3.0,
  "S3.n.C": 3.0,
  "S3.vap.A": 3.0,
  "S3.vap.B": 3.0,
  "S3.vap.C": 3.0,
  "S4.N": 3.0,
  "S4.P": 100000.0,
  "S4.T": 100.0,
  "S4.n.A": 3.0,
  "S4.n.B": 3.0,
  "S4.n.C": 3.0,
  "S5.N": 3.0,
  "S5.P": 100000.0,
  "S5.T": 100.0,
  "S5.n.A": 3.0,
  "S5.n.B": 3.0,
  "S5.n.C": 3.0,
  "S6.P": 100000.0,
  "S6.T": 100.0,
  "S6.n.A": 3.0,
  "S6.n.B": 3.0,
  "S6.n.C": 3.0,
  "S7.P": 100000.0,
  "S7.T": 100.0,
  "S7.n.A": 3.0,
  "S7.n.B": 3.0,
  "S7.n.C": 3.0,
  "U-FLASH.Q": 100000.0,
  "U-HEAT.Q": 100000.0
 },
 "continuation": null,
 "core": "newton",
 "counters_at_open": {
  "cache_hits": 0,
  "factorizations": 4,
  "jacobian_calls": 2,
  "property_calls": 0,
  "requested_evaluations": 0,
  "residual_calls": 8
 },
 "evaluation_context": {
  "accuracy_policy": "exact-double",
  "constants_sha256": "4054a86c0dd9fae56ff0462e137966622a68513bf4ba7d0a84934ffa4a07656d",
  "model_version": "SYN001-fs1-syn001-4e4c37cc8054-44f894ff62f9@73a8950bc0038a967ddf8cf7f5d1d07695ff6c230e1965ff898fe8e02ef67769",
  "phase_signature": null
 },
 "flowsheet_context": {
  "accuracy_policy": "exact-double",
  "constants_sha256": "0000000000000000000000000000000000000000000000000000000000000000",
  "model_version": "K03-fixtures@0000000000000000000000000000000000000000000000000000000000000000",
  "phase_signature": null
 },
 "jacobian_pattern": {
  "columns": 44,
  "nnz": 155,
  "rows": 44,
  "sha256": "fcbaf4b5d0d51dd6f565e4a17f849e470fda9a3ffb3d0521f0a5586d6b27d4a4"
 },
 "opened_from": {
  "attempt_index": 0,
  "checkpoint_id": "attempt-0",
  "continuation_lambda": null,
  "full_state_sha256": null,
  "iteration": 2,
  "jacobian_identity": null,
  "label": "partial",
  "merit": 0.06407623291015623,
  "residual_inf_unscaled": 0.9843749999999998,
  "scale_segment": 0,
  "signature": [
   [
    "U-FLASH",
    "LIQUID"
   ]
  ],
  "state_sha256": "cc103a89505563b925a621de6ea4e1240058720a5a76ec48e8f6dc783053fbd5",
  "step_index": null,
  "variable_ids": [
   "S6.n.A",
   "S6.n.B",
   "S6.n.C"
  ],
  "verification_scope": "unverified"
 },
 "opened_reason": "phase_update",
 "row_scales": {
  "U-FEED:FEED-P": 100000.0,
  "U-FEED:FEED-T": 100.0,
  "U-FEED:FEED-n:A": 3.0,
  "U-FEED:FEED-n:B": 3.0,
  "U-FEED:FEED-n:C": 3.0,
  "U-FLASH:FLASH-P:inlet": 100000.0,
  "U-FLASH:FLASH-P:liquid": 100000.0,
  "U-FLASH:FLASH-P:vapor": 100000.0,
  "U-FLASH:FLASH-T:liquid": 100.0,
  "U-FLASH:FLASH-T:vapor": 100.0,
  "U-FLASH:FLASH-duty": 100000.0,
  "U-FLASH:FLASH-equilibrium:A": 9.0,
  "U-FLASH:FLASH-equilibrium:B": 9.0,
  "U-FLASH:FLASH-equilibrium:C": 9.0,
  "U-FLASH:FLASH-mole:A": 3.0,
  "U-FLASH:FLASH-mole:B": 3.0,
  "U-FLASH:FLASH-mole:C": 3.0,
  "U-FLASH:Ndef:liquid": 3.0,
  "U-FLASH:Ndef:vapor": 3.0,
  "U-HEAT:HEAT-T": 100.0,
  "U-HEAT:HEAT-duty": 100000.0,
  "U-HEAT:HEAT-equilibrium:A": 9.0,
  "U-HEAT:HEAT-equilibrium:B": 9.0,
  "U-HEAT:HEAT-equilibrium:C": 9.0,
  "U-HEAT:HEAT-mole:A": 3.0,
  "U-HEAT:HEAT-mole:B": 3.0,
  "U-HEAT:HEAT-mole:C": 3.0,
  "U-HEAT:HEAT-pressure": 100000.0,
  "U-HEAT:Ldef": 3.0,
  "U-HEAT:Vdef": 3.0,
  "U-HEAT:split:A": 3.0,
  "U-HEAT:split:B": 3.0,
  "U-HEAT:split:C": 3.0,
  "U-MIX:MIX-energy": 100000.0,
  "U-MIX:MIX-mole:A": 3.0,
  "U-MIX:MIX-mole:B": 3.0,
  "U-MIX:MIX-mole:C": 3.0,
  "U-MIX:MIX-pressure:0": 100000.0,
  "U-MIX:MIX-pressure:1": 100000.0,
  "U-SPLIT:SPLIT-P:purge": 100000.0,
  "U-SPLIT:SPLIT-P:recycle": 100000.0,
  "U-SPLIT:SPLIT-T:purge": 100.0,
  "U-SPLIT:SPLIT-T:recycle": 100.0,
  "U-SPLIT:SPLIT-purge:A": 3.0,
  "U-SPLIT:SPLIT-purge:B": 3.0,
  "U-SPLIT:SPLIT-purge:C": 3.0,
  "U-SPLIT:SPLIT-recycle:A": 3.0,
  "U-SPLIT:SPLIT-recycle:B": 3.0,
  "U-SPLIT:SPLIT-recycle:C": 3.0
 },
 "scale_segment": 0,
 "signature": [
  [
   "U-FLASH",
   "TWO_PHASE"
  ]
 ]
}
